start	end	text
1457000	1458000	Hello, I saw you at work today.
1458000	1459000	You turned up to meet your mate.
1459000	1460000	Yeah, yeah, I did, yeah.
1460000	1461000	I wondered if I could take you out.
1461000	1462000	Er, let me think about it.
1462000	1464000	I thought, oh, damn it, she went.
1464000	1465000	Yeah, OK, then.
1465000	1466000	That was it.
1466000	1468000	It's such a romantic that you live on the set of Billy Elliot
1468000	1469000	meets Postman Pat.
1471000	1473000	Absolutely brilliant, it was.
1473000	1474000	So, yeah, well done, mate.
1474000	1475000	Well done, you, man.
1475000	1476000	Glad you.
1481000	1482000	Sport with peers.
1482000	1486000	Trotting along the beach, looking vaguely happy with himself.
1486000	1490000	So I think Piers might be off to try and have poo number one.
1490000	1493000	How many days has he been without poo?
1493000	1494000	He's 17.
1495000	1498000	Dr Piers is now the only member of the group
1498000	1500000	who has not yet joined the poo crew.
1502000	1503000	Any luck, mate?
1503000	1504000	No luck today, mate.
1506000	1507000	Here we come.
1508000	1509000	Here he comes.
1509000	1510000	Don't do it.
1510000	1511000	Dr Piers.
1511000	1512000	Dr Piers?
1512000	1513000	Have we succeeded?
1513000	1514000	Is it?
1514000	1515000	Is it?
1515000	1516000	No.
1516000	1517000	Oh, no.
1517000	1518000	No!
1518000	1519000	Mission failure.
1519000	1520000	Oh, no.
1520000	1521000	NASA, we have a problem.
1521000	1522000	Close.
1522000	1523000	Be patient, lads.
1523000	1524000	Be patient.
1524000	1527000	Go in your medical kit, get a rubber glove, because I'm going in.
1534000	1535000	Have fun, boys.
1535000	1536000	Cheers, mate.
1536000	1537000	We'll do our best.
1537000	1538000	Mid-afternoon.
1538000	1540000	After a couple of hours' rest,
1540000	1542000	the men get back to work.
1542000	1543000	Come on, my son.
1543000	1544000	Bite.
1544000	1546000	Two weeks ago, they were dropped on the island
1546000	1548000	with eight fishing hooks,
1548000	1550000	but now they're down to just two.
1551000	1552000	Shit.
1552000	1553000	Could you unsnag my line?
1553000	1554000	I've caught it on the rock.
1555000	1556000	Shit.
1556000	1558000	No, we've lost another rod there, guys.
1558000	1559000	Shit.
1559000	1560000	We've lost a hook.
1562000	1563000	Further down the beach,
1563000	1567000	oil engineer Dan and Dr Piers swim out to check the net.
1567000	1568000	What do we think we've done?
1568000	1569000	Nothing.
1569000	1570000	What do we think, William?
1570000	1572000	Do you think there's going to be anything on there?
1572000	1573000	You're saying it.
1573000	1575000	There's lots of rocks.
1575000	1577000	Anything, Barney?
1577000	1580000	No, sadly not.
1580000	1582000	We're hoping for the nets.
1582000	1584000	So I've got to see this moment.
1592000	1594000	Doesn't look like a trawl.
1594000	1597000	No, I guess far as it says, it looks like the square root of Eiffel.
1597000	1598000	What's wrong?
1599000	1600000	It looks like we'll be going hungry for dinner.
1600000	1601000	Huh?
1601000	1602000	It looks like we'll be eating ass.
1602000	1603000	The nets are empty.
1603000	1604000	Is that right?
1604000	1605000	Shit.
1605000	1606000	What's happening, fella?
1606000	1607000	This is what we've caught.
1607000	1610000	Caught a load of coral.
1610000	1611000	Fuck.
1611000	1616000	The razor sharp coral has taken over the water.
1616000	1617000	It's gone.
1617000	1618000	It's gone.
1618000	1619000	It's gone.
1619000	1620000	It's gone.
1620000	1621000	It's gone.
1621000	1622000	It's gone.
1622000	1623000	It's gone.
1623000	1624000	It's gone.
1624000	1625000	It's gone.
1625000	1626000	It's gone.
1626000	1627000	It's gone.
1627000	1628000	It's gone.
1628000	1630000	The razor sharp coral has destroyed the men's net.
1630000	1631000	No fish at all.
1631000	1632000	Oh.
1632000	1633000	Shit.
1633000	1634000	We really are up Chips Creek, aren't we?
1634000	1635000	With no net, one fishing hook.
1635000	1636000	Situation just went from bad to much, much worse.
1636000	1637000	What do you think, Phil?
1637000	1638000	Well, that's disastrous.
1638000	1639000	That's no food for anyone, and no means to get food.
1639000	1640000	Shit.
1640000	1641000	We've got one hook in the net.
1641000	1642000	Done.
1642000	1643000	Done.
1643000	1644000	Done.
1644000	1645000	Done.
1645000	1646000	Done.
1646000	1647000	Done.
1647000	1648000	Done.
1648000	1649000	Done.
1649000	1650000	Done.
1650000	1651000	Done.
1651000	1652000	Done.
1652000	1653000	Done.
1653000	1654000	Done.
1654000	1655000	Done.
1655000	1656000	Done.
1656000	1657000	Done.
1657000	1660200	Shit, we've got one hook left. We're fucked.
1660240	1663800	So, we've got one hook to fish for a month.
1663840	1666080	It's pretty depressing, yeah? More than one.
1666120	1668000	No joy with nets.
1668040	1670160	Fuck, are we going to be depleted, or what?
1672320	1674240	Disaster.
1674280	1676880	We're down to our last fishing hook.
1676920	1678840	So...
1678880	1681240	the onset of starvation looks upon us.
1687000	1691000	With morale at rock bottom, Barney, Phil and Sam Farmer
1691040	1695160	head out to the lagoon for the daily check of Vic's crocodile traps.
1696920	1700200	Chances of catching a caiman, 4%.
1705600	1707600	The caiman's definitely been here.
1707640	1710920	How do you know that? Because the trap is destroyed.
1710960	1713000	Gosh, look at that.
1713040	1716040	It's almost certain that it's been here for a long time.
1716080	1716960	It's been here for a long time.
1717000	1719960	It's certainly been triggered by a caiman.
1720000	1722960	The bait's gone, the trigger's occurred,
1723000	1724640	and it looks like there's been a bit of a struggle,
1724680	1726920	and the rope is firmly in the water.
1726960	1729320	Well, that is incredibly encouraging in one sense.
1729360	1730560	Very.
1730600	1732360	Is there any chance that the caiman could still be on the end?
1732400	1734360	There is a chance.
1734400	1735200	OK.
1735240	1736280	Fuck, he is.
1736320	1737760	Is he? Shit.
1737800	1739400	I think he's under here, isn't he?
1739440	1741040	Is that his back? No way.
1741080	1742840	Is this his back here?
1742880	1743880	Come here.
1743880	1745880	We need to be a bit careful about this.
1745920	1748000	I can see scales on the back of that rope.
1752080	1757080	I can see there are crocodile or caiman-like scales
1757120	1759400	just underneath the water.
1765440	1767000	I'm convinced... Go and have a look.
1767040	1769000	I'm convinced he's there.
1769040	1770840	Just be careful. Be very careful.
1770880	1771920	He's there.
1771960	1772920	He's there.
1772920	1774400	Just be careful. Be very careful.
1776520	1777960	There's no doubt about it, the caiman's there.
1778000	1779000	Yeah.
1781800	1785520	There is a caiman in the water right next to us now.
1785560	1788120	We need to be careful, cos as soon as we drag him out there,
1788160	1790040	he's going to be angry.
1790080	1791720	I can't quite... I cannot quite believe it.
1791760	1793560	No, I can't either.
1793600	1794840	I cannot believe it.
1797240	1798880	My heart... Mine too.
1798920	1801600	Is your heart beating? Mine too, cos he's obviously alive, right?
1802920	1803920	Yeah.
1803960	1807920	So, the crocodile is the largest, it's the meatiest animal
1807960	1809720	they're going to find on the island.
1809760	1812160	But when they're cornered or they're scared,
1812200	1814320	that's when they're most likely to attack.
1814360	1817400	And if you're in the wrong place at the wrong time,
1817440	1818800	you're in trouble.
1818840	1822960	The minute we disturb this, all hell will break loose.
1823000	1824720	The three of us could take him on.
1824760	1826720	I think it's sensible to go and get many more hands.
1826760	1829080	I want you two to stay here. I'll run back to camp.
1829120	1830960	Yeah. Deliver the news. Yeah.
1831000	1832560	And we're going to pull him out of that trap.
1832560	1835680	He's going to fight like buggery. Absolutely.
1835720	1837840	Go on, Barney. Excellent. Yes!
1843400	1846920	Crocodiles can remain submerged for hours before surfacing.
1846960	1850920	And as a lagoon is their ideal habitat,
1850960	1854400	it's certain to be populated by more than just one.
1854440	1858400	There's definitely an alligator moving this way.
1858440	1862520	It's a little bit weird looking at one that could get you right here.
1862560	1867000	And another one that's heading towards you.
1867040	1868600	It's almost like, where the bait?
1870640	1873120	Barney's looking excited. What's up, Barney?
1873160	1874720	OK, come in, come in. Gather in, gather in.
1877200	1878520	OK, so we're...
1883720	1887200	He's ready. I'd say we're 95% sure
1887240	1889160	we've got a caiman in our second trap.
1889200	1892200	Fuck off. Let's rock and roll, boys.
1892240	1892440	Let's rock and roll.
1892560	1893760	Let's rock and roll.
1893800	1895120	I think we nailed it.
1895160	1896880	Let's go. Let's go.
1896920	1900200	Oh, this is exciting. This is exciting.
1900240	1902080	Bingo, big fella.
1902120	1904400	It's either that or a scaly log.
1904440	1906400	A scaly log we will eat.
1906440	1910240	Despite being too exhausted to help with the group's daily tasks,
1910280	1915440	the prospect of a crocodile feast has inspired Kyle to join the hunting pack.
1915480	1916480	Let's do it, lads.
1920480	1922200	I feel like Gandalf with my giant...
1922200	1924200	I feel like Gandalf with my giant shaft.
1929240	1930240	How are you feeling, Barney?
1930280	1932760	It's very difficult because I'm so excited and this is all what we want,
1932800	1935760	but when it comes to actually pulling the animal out and having to kill it,
1935800	1937760	I don't know how I feel at all.
1937800	1939760	For the moment, absolutely buzzing.
1939800	1942120	Yeah, definitely feel like a tribe on a hunt.
1942160	1943120	Yeah, it does, doesn't it?
1943160	1945480	Everyone's come out prepared.
1945520	1949000	Oh, this is the most excitement I've felt since I've bloody been here.
1949040	1950160	How are you feeling, Vic?
1950200	1952080	I'm feeling excited.
1952080	1956080	But we've got a job to do, we dispatch it in a humane manner as we can.
1956120	1958640	But, woohoo, that's how I'm feeling.
1960680	1964600	When you're hunting crocs, you've got to make sure that you don't become the prey
1964640	1967280	because these prehistoric beasts are fast.
1967320	1970880	Once they get a hold of you, grab you, drag you into the water,
1970920	1975320	then they strike, bam, lightning speed and incredible power.
1978760	1980960	What's weird is I can see it and it's got its eye open.
1981000	1981920	What's weird is I can see it and it's got its eye open.
1981920	1982760	What's weird is I can see it and it's got its eye open.
1982800	1985200	This thing is going to go absolutely mental.
1985240	1987640	Absolutely mental when it comes out.
1987680	1990800	Such a blessing. It's a dangerous animal, but we need the food.
1990840	1992120	We need the food.
1992160	1994800	This way, guys. Barney.
1994840	1996560	I've got the cavalry.
1996600	1998840	Putting on the cavalry.
1998880	2000040	Where is it?
2000080	2003920	It literally is just where you can see that blue rope by the log.
2003960	2006080	The blue rope is wrapped around the caiman.
2006120	2008560	Oh!
2008600	2010120	He's big, boys, he's big.
2010160	2011120	OK, he's moving.
2011120	2013400	We need to get a loop over that mouth.
2013440	2016080	I think one of these branches has him pinned.
2016120	2019600	He's making bubbles, I think he's going to do something.
2019640	2020800	Here we go, there we go.
2020840	2022400	Look at that beauty.
2022440	2023400	He needs to breathe, doesn't he?
2023440	2025320	He's hissing at us.
2025360	2028280	OK, he's trying to go back.
2028320	2029840	Here we go, boys.
2029880	2031240	Right, where's that rope with the hook?
2031280	2032760	Here, look, look.
2032800	2035320	OK, boys, we need two people on that rope.
2035360	2037000	We need to pull him ashore.
2037040	2038240	Is his mouth open?
2038280	2040920	His mouth is slightly open.
2040920	2042200	OK, big.
2042240	2045400	Nice and calmly, boys.
2045440	2046880	Come on, big.
2046920	2048440	Whoa, come on, baby.
2048480	2049440	Come on, big.
2052440	2054440	Right, nobody moves, his mouth's open.
2054480	2057440	Yeah, you get him, you get him.
2057480	2058960	You fucking get him.
2059000	2062040	Round his neck, round his neck.
2062080	2064040	That's it, we got you, little sod.
2064080	2065040	Come on, big boy.
2065080	2067040	Come on, boys, come on.
2067080	2069040	Right, I'll distract him.
2069080	2070040	Hey, Mr Croc.
2070080	2070760	Hey.
2070760	2073640	Hey, look at me, look at me, look at me.
2073680	2076000	Ooh, ooh, ooh.
2076040	2078200	OK, OK, Vic, go now, go now.
2078240	2079760	He's probably going to roll soon.
2079800	2081320	Over the teeth, over the teeth.
2081360	2083040	Oh, branch, one more, one more.
2083080	2084160	Mate, mate, mate, you've almost got it.
2084200	2085880	Watch him, watch him, go now, go now.
2088680	2090320	You're in, you're in, you're in, you're in, you're in.
2090360	2091520	Here we go, puppy dog.
2091560	2093600	Yes, yes.
2093640	2094600	Ah, you little fucker.
2094640	2096920	Watch him, watch him.
2096960	2099240	Right, Sam, I'm very conscious of you stood in the water, mate.
2099280	2100200	There is another one in that lake.
2100200	2101440	Yeah, get out of there.
2101480	2102640	Yeah, get on the bank, Sam.
2106440	2107520	Sam, Sam.
2107560	2109040	Sam, watch his tail.
2109080	2110280	Sam, get out of the water, mate.
2110320	2111640	Mate, mate, I think we're good.
2111680	2113760	No, see, there is another one in this lake.
2113800	2115840	If he came along and nipped your heel...
2115880	2118040	Let's just fucking get this guy.
2118080	2119880	Have we got enough people tugging on that rope?
2119920	2121520	Yeah, yeah, Charles has got it.
2121560	2122480	There we go.
2122520	2123760	Right, we now have two.
2123800	2125360	That's it.
2125400	2126840	He can still snap, can't he?
2126880	2128680	Watch his tail on your legs.
2128720	2130040	I am on it, I'm on it, don't worry.
2130200	2131040	All right.
2131080	2132480	And again, Barney, and again, Barney.
2132520	2134160	No, no, no, look what it's snagged on now.
2134200	2135600	Right, it's snagged on this one.
2135640	2137000	Take your time, fellas.
2137040	2139600	Right, don't cut the rope.
2141440	2143480	Oh, shit, he's growling.
2143520	2145280	This fucker is fucking powerful.
2145320	2146120	Give him a minute.
2146160	2147960	I think he speaks English.
2148000	2148960	Where's the knife?
2149000	2149800	I've got a knife with me.
2149840	2151120	Get the knife out ready.
2151160	2153000	And then, Kyle, what are you doing?
2153040	2154680	You're going to drive the knife, take him out.
2154720	2156320	Right, where are you going to put it?
2156360	2158480	Just behind his eyes, let's go.
2158520	2160080	Heads on, guys, heads on, heads on.
2160200	2161320	We go on go.
2161360	2162960	One, two, three, we all go on go.
2165160	2166160	One.
2168920	2171400	Two, three, go.
2172360	2174280	Come on, boys, get in there, get in there.
2174320	2176000	Drive it out, drive it out.
2176040	2177800	Go on, lads, push it in.
2177840	2179720	Push it, lads, that's the one, boys.
2179760	2180760	That's it, that's it.
2182880	2184120	Yes, mate, yes.
2184160	2185640	That's it.
2185680	2188360	Gentlemen, we have handbags.
2188400	2189320	Come on.
2189360	2190000	Nice teamwork.
2190000	2191200	Look them down, boys.
2191240	2191920	Come on.
2191960	2193560	Come on, boys.
2193600	2194520	Back it up.
2194560	2196160	Come on, boys.
2196200	2199600	Oh, he's twitching, he's twitching, he's moving.
2199640	2201800	Kyle, fucking killer blow, mate.
2201840	2204000	That was awesome.
2204040	2205560	Get in there, boys.
2205600	2206840	Woo!
2206880	2208400	Actually wrapping up a dinosaur.
2208440	2211520	We just caught a prehistoric animal.
2211560	2212760	Damn it.
2212800	2213520	Amazing.
2213560	2214400	It feels so caveman.
2214440	2215080	Doesn't it?
2215120	2216280	Doesn't it feel so caveman?
2216320	2217080	Yes.
2220000	2222080	If Fierce doesn't shit after eating a load of this,
2222120	2223320	he's got a serious problem.
2223360	2224360	I know, just.
2229280	2232160	How many people in the world can say,
2232200	2234200	wrestle the crocodile that killed him?
2234240	2236360	We are in an elite group of blokes.
2236400	2239880	After 17 days without anything substantial to eat,
2239920	2242520	the men have finally hit the jackpot
2242560	2245520	and dispatched one of nature's most fearsome predators.
2245560	2248120	Seeing this, it does make you have respect for crocodiles.
2248160	2249680	This is a big one, really big one.
2249680	2251520	So I just wanted to get it done in a clean way
2251560	2252720	without making a mess of it.
2252760	2255400	To pull it off and grab a croc like this is amazing.
2255440	2256600	Should we rock and roll then, boys?
2256640	2257400	Yeah.
2257440	2260560	One, two, three, up.
2260600	2261160	Kyle.
2261200	2261840	Yeah.
2261880	2264240	What would you be doing in your normal life right now?
2264280	2266200	Back home, it'd be a bit more mundane than this.
2266240	2269320	I definitely wouldn't have a croc on my shoulders.
2269360	2272360	Seriously, look how much meat there is on that bad boy.
2272400	2275480	Fucking awesome.
2275520	2276840	Not only have the men proved
2276880	2278960	that they're top of the island's food chain,
2278960	2282320	but after surviving on roughly 400 or 500 calories a day,
2282360	2287000	suddenly they've landed themselves a feast of just epic proportions.
2287040	2290120	Just think of that fucking delicious dinner we're going to have later, boys.
2290160	2293840	News of the big catch soon spreads around the island.
2293880	2296080	Come on, fellas.
2296120	2297840	Oh, my God.
2297880	2299920	Holy shit.
2299960	2302000	Oh, my God.
2302040	2305240	No fucking way.
2305280	2308440	You are absolutely shitting me.
2308440	2311760	That is absolutely enormous.
2314680	2317640	That's amazing, isn't it?
2317680	2319800	That is amazing.
2322800	2323640	Woo-hoo!
2323680	2324960	Keep going, lads.
2325000	2327720	Fucking hell.
2327760	2330080	And roll, roll.
2330120	2331320	Get in there, boys.
2331360	2334240	Yeah!
2334280	2335280	Woo!
2335320	2336280	Yeah!
2336320	2337280	Yeah!
2337320	2338240	Yeah!
2338440	2339440	Woo-hoo!
2339480	2340440	Come on, lads!
2340480	2341440	Come on, lads!
2346560	2348840	A crock of this size could provide the men
2348880	2350960	with tens of thousands of calories.
2352840	2354640	What do you think of that, big boy?
2354680	2356760	That's beautiful.
2356800	2358280	Give some respect to him.
2358320	2361560	Out of the water, trapped, dispatched, we in 15, 20 minutes.
2361600	2362560	Yeah.
2362600	2363560	That's brilliant.
2363600	2364600	I'm pleased about that.
2364640	2366800	We were very respectful of her.
2366840	2368400	Oh, my God.
2368440	2371040	I think I can see a plate of meat coming along.
2371080	2372360	Oh, hello.
2372400	2373680	Look at this, boys.
2373720	2375680	As if you didn't need any more motivation.
2378360	2382000	Today, I managed to catch a bloody crocodile.
2382040	2384080	And my God, was it something.
2384120	2388600	I'm normally at a desk or on a phone talking to clients.
2388640	2391440	I don't kill crocodiles.
2392440	2393840	Carl, look at that.
2393880	2394840	Oh, mate.
2394880	2395880	Get in.
2395920	2397440	Unbelievable.
2397480	2398360	Wow.
2398440	2400880	Look at that.
2400920	2402960	Let the feast begin, boys.
2403000	2404960	Yes.
2405000	2406720	Boys get stuck in, it's like chicken.
2409280	2410280	That is wonderful.
2416800	2420560	Just had my first taste of crocodile.
2420600	2424080	To me, it just tasted absolutely divine.
2424120	2426920	It's nice to have a mouthful of meat, isn't it?
2426960	2428080	Not just a nibble.
2428080	2430560	We all get more than we can possibly eat.
2430600	2432240	Here's the heart.
2432280	2434160	This is Kyle's, the killer.
2434200	2437640	Kyle, salute you, sir.
2437680	2441120	Based on the fact that I killed the croc,
2441160	2443400	I was given the privilege of eating his heart.
2443440	2445400	It felt like a good feeling.
2445440	2449600	Almost like a prize for doing a good job.
2449640	2450600	Go on, Kyle.
2453520	2455040	I feel like you're inheriting its strength.
2455080	2456040	Like a boss.
2456080	2456600	Yeah.
2456600	2458360	Oh, f**k, that was nice.
2458400	2459520	God, that was nice.
2459560	2462880	Oh, that second piece I took was beautiful.
2464920	2467640	Oh, God, I feel like it's after Sunday dinner at home.
2469800	2471920	Absolutely lovely.
2471960	2474120	What a lovely, lovely feeling that is.
2476560	2478000	I feel sorry for Piers,
2478040	2479480	because he needs to open his bowels,
2479520	2481200	otherwise it's going to be painful.
2481240	2484040	Oh, he's going to open them after this.
2484080	2486400	So I was absolutely dead on my feet.
2486400	2490320	I was completely and utterly gone.
2490360	2494880	And suddenly, the morale boost the team needed,
2494920	2499320	needed that so badly, to kick the spirits up.
2499360	2502320	I think this counts as just for today,
2502360	2504320	if nothing else, more than surviving.
2512360	2513680	6am.
2513720	2515520	MUSIC PLAYS
2515520	2519200	Dr Piers is feeling the benefit of last night's feast.
2524120	2525880	Here, you've got some big news for me.
2525920	2529440	Yeah, I am the last member of the poo club.
2529480	2531160	Well done, Piers.
2531200	2533320	Do you want to give Piers a round of applause?
2533360	2534400	Yes!
2534440	2535440	Yes, Piers.
2535480	2536440	Brilliant.
2536480	2537920	Yes, Piers.
2537960	2538880	How did it feel?
2538920	2540560	It felt great, actually.
2540600	2541520	Really good.
2541560	2543600	I thought it was going to be really hard.
2543640	2545480	I thought it was going to be like rabbit droppings.
2545520	2546800	It's stuck together.
2546840	2548720	Oh, what was it like?
2548760	2550160	Like a wet sausage.
2550200	2551160	A wet sausage?
2551200	2552160	Yeah.
2552200	2553160	Dreamy.
2553200	2554400	Absolutely dreamy.
2554440	2555400	Yeah.
2555440	2556880	It's that crock pushed it all down.
2560560	2562520	Lads, crock's ready.
2563920	2566840	With plenty of crocodile meat still left over,
2566880	2569920	cameraman Ross serves up breakfast.
2569960	2572760	Char-grilled to smoky perfection.
2572800	2574600	Oh, that's good, isn't it?
2574600	2575840	I think it's better.
2575880	2577720	I think it's better than yesterday.
2584120	2587600	With their bellies full, the men set about their daily chores.
2589080	2590080	Look at that.
2590120	2595400	We have done wood in the same time it took Kyle to get dressed.
2595440	2597200	Tell me that ain't the greatest thing.
2597240	2599560	Right, right.
2599600	2600920	Team effort, boys.
2604600	2608080	I feel like I can just lie on this beach right now
2608120	2610080	and think about nothing and do nothing
2610120	2613080	and not feel guilty for the first time pretty much since we got here.
2613120	2615080	Does this feel personal collection, though?
2615120	2616080	This is only for me.
2616120	2617080	I thought so, mate.
2617120	2618080	A bit slower.
2618120	2619080	I thought that.
2619120	2620080	A bit slower.
2620120	2621080	That's it.
2621120	2622080	That's it.
2622120	2623080	It's working.
2623120	2624080	Oh, what?
2624120	2625080	That's it.
2625120	2626080	That's it.
2626120	2627080	That's it.
2627120	2628120	That's it.
2628160	2629160	That's it.
2629200	2630200	That's it.
2630240	2631240	That's it.
2631280	2632280	That's it.
2632320	2633320	That's it.
2633360	2634440	That's it.
2634600	2635600	That's it.
2635640	2636640	Lovely.
2636680	2640640	Enjoy the idyllic tropical sunshine.
2640680	2642640	I think life isn't too bad after all.
2651160	2652880	For the second night in a row,
2652920	2656480	the men anticipate a hearty feast of crocodile meat.
2656520	2658760	Does everyone fancy the last of the crock?
2658800	2660920	I would love a bit.
2660960	2663320	As well as giving the group vital calories,
2663320	2665280	the sudden intake of rich food
2665320	2668040	appears to have solved another of the men's problems.
2668080	2672360	Dan, how were your ablutions this afternoon?
2672400	2675080	Danny had a trump and a fall of food, didn't he?
2675120	2677800	He shit himself this afternoon while he was making his bed.
2677840	2678800	It's dribbling down my legs.
2678840	2679800	Just a little bit.
2679840	2681440	A little bit of boo came out.
2681480	2682720	I had to squeeze my socks out.
2682760	2683720	Who's that by the way?
2683760	2684720	Oh, God.
2684760	2686360	Well, you fucking arsed, didn't you?
2688360	2691400	Crocodile broth this evening.
2691440	2693280	It's going to be superb.
2693360	2695320	Come on, boys, dig in, please.
2695360	2696360	Pass it round.
2698880	2699880	How is it, Vic?
2699920	2700920	Oh, it's strong.
2702440	2704040	I think strong is a good word.
2704080	2706280	There is some distinct smell of poo about this.
2706320	2707840	It smells a bit like dog shit, doesn't it?
2707880	2709600	It does smell a bit suspicious, doesn't it?
2709640	2710600	Yeah.
2710640	2711600	Shit.
2711640	2712920	Oh, crikey.
2712960	2714440	Phil, what's the verdict?
2714480	2717360	I've had two mouthfuls and that's two mouthfuls too many.
2717400	2718840	I can feel the squirts coming on.
2720480	2722200	The 30-degree tropical heat
2722240	2723160	is making the food smell.
2723320	2726320	The meat has spoiled the remains of the crocodile,
2726360	2730320	leaving the men, once again, with nothing to eat.
2730360	2733680	The final meal of my croc, it was basically rotten meat.
2733720	2735120	It was pretty...
2736360	2737360	Like it?
2738880	2740960	I don't want to think about it too much.
2742360	2745400	It was pretty much the worst thing I've ever had in my life.
2746640	2748080	Oh. Oh, dear.
