start	end	text
0	14700	two uninhabited Pacific Islands more than 5,000 miles from the UK one will be inhabited by 14
14700	23240	British men while a separate island will be home to 14 British women for six weeks they'll be
23240	30860	utterly alone with only the clothes they stand up in and a handful of basic tools filming everything
30860	40940	themselves when pushed to the limits of human endurance will it be brute power or mental
40940	51740	strength the Windsor day it's too cute I can't who will have what it takes to stay alive tonight we
51740	52980	follow the men's island
53240	65300	it's a scorpion guys it'll be harder than ever they'll have to endure the height of the harsh
65300	70700	tropical storm season a bit like being in a disaster film they'll have to find their own water
72620	81380	and hunt for their own food watch him watch him go now go now that is amazing have these modern
81380	82940	day men got what it takes
83240	89240	to survive we're all sweating our bollocks off up there fella and it looks like yeah yeah looks
89240	90980	like you're doing call when it comes to wood
94700	104780	two weeks ago 14 British men were cast away on this remote Pacific Island
106580	112460	that was the dumbest thing I ever did but now three of the men have quit now the dead weight's off let's get on with it
113240	117200	there and the island has taken its toll on the 11 that remain
119060	121460	I'm genuine I've never been so terrified in my life
123680	129260	having barely found anything substantial to eat they're now on the brink of starvation
130460	133580	we ain't conquered Jack nothing
143240	149240	and they say nothing
149240	152020	speaking of who you are
152260	154920	scriptwriting
154920	160340	it's a bit like being in a disaster film or you know or when um you hear on the
160340	168920	news that people have had a typhoon come through or a flood there's no water there's no electricity
168920	170600	you know stomachache
170600	171600	car is definitely needs some organます
171600	172820	could you get on with the show
172820	175840	like you've been hit by a major disaster.
185360	187260	Oh, look, another day in paradise.
190840	194040	It's been 15 days since the men arrived on the island.
197320	200600	And so far, they have survived on a meager diet
200600	204840	of a few hundred calories a day.
204840	210260	So thin now, like ribs, all sorts of bones
210260	215380	appearing that I haven't seen since I was a bloody teenager.
215380	218760	Oh, hang on.
218760	222000	Oh, hang on.
222000	224620	Lie down, mate, if you've.
224620	226220	Oh.
226220	227900	It's the nearest I've got to fainting,
227900	230000	or I assume it's fainting, having never
230000	230600	fainted before.
230600	234140	But my vision just went, like, pulsating in and out,
234140	236420	in and out, in and out, in and out.
236420	239300	And then before I knew it, I was on my ass.
239300	240220	Sort of semi-collapsed.
246420	250820	We're surviving off limpets and, like, the odd one fish.
250820	253720	It's not going to sustain us for the next god-how-ever weeks.
253720	257220	I think another week of this, we'll be struggling massively
257220	259080	just to even get up in the morning.
259080	260000	We need to find a way.
260000	264740	We need to find a solid source of food or, you know,
264740	266000	we're going to be facing meltdown.
269000	270240	We're out of food.
270240	272700	The bottom line is we don't have any food other than limpets.
272700	273780	We're getting weaker and weaker.
273780	275940	I certainly feel like I'm getting weaker and weaker.
275940	280480	So my priority is how I feel about, personally, is food.
280480	282160	I think the majority of our resources
282160	285940	should be to getting us good fish today.
285940	287240	Let's go.
287240	288660	We are going to find lunch.
290000	297000	Come on, fishy, fishy, fishy.
297000	301000	In a survival situation, you always face one huge dilemma.
301000	303700	And that is, if you want to eat, you've got to hunt.
303700	305440	Hunting burns your energy.
305440	308500	And there's no guarantee you're actually going to catch
308500	310360	anything at the end of it.
310360	311940	Any glimmers yet, Vic?
311940	313180	Oh, I can see fish.
313180	314920	Can you?
314920	318000	Bastard, you.
318000	320000	Every time you go looking for food, you're gambled.
320000	321000	You're gambling.
321000	323000	You're gambling with your energy reserves.
323000	324000	You know what, Pidge?
324000	326000	You seem to be a bit lacking in enthusiasm.
326000	331000	Oh, I'm so dead on my feet.
331000	333000	I'm actually dead on my feet.
333000	336000	I feel just completely gone.
341000	345000	You just keep nibbling it straight off the end.
345000	347000	The luck of the gods is not with us today.
350000	352000	Everyone's getting tired.
352000	353000	Everyone's hungry.
353000	354000	Everyone's sick of bacon limpets.
354000	355000	We need some decent food.
355000	356000	We need it quick.
356000	370500	If we don't get it soon, we're just going to start dropping like fires.
370500	375000	Despite the group's desperation, one man refuses to be beaten.
375000	379000	Let's all push it to the edge.
379000	380000	I feel fine.
380000	381000	Another day at the office.
381000	386000	I feel really good, yeah.
386000	395000	Vic wants to change tactics and take the hunt to an unexplored part of the island.
395000	401000	One kilometer from camp is a vast freshwater lagoon where he believes a much bigger prize
401000	403000	could be lurking.
403000	407000	One that could provide the group with the calories they so desperately need.
407000	408000	We are going hunting for fish.
408000	410000	We are going hunting for Mr. Cayman.
410000	413000	Let's go lay some traps, fellas.
413000	416000	Let's go hunt some beast.
416000	424000	As well as the search for food, the men's survival depends on them having a constant supply of drinking water.
424000	432000	They need at least 30 liters a day, which they must collect on a back-breaking two-kilometer round trip.
432000	436000	Sam, when you go past Carl, can you ask him to come and help do the water run, please?
438000	441000	He's not shirking, is he?
441000	445000	Hey, I'm just saying the water run he's doing, and he's chewing his gums.
445000	447000	You do the maths.
447000	449000	All right.
449000	450000	Let's go.
450000	452000	Grab Carl.
452000	456000	Kyle, are those crocs going to be okay for going across to get some water?
456000	460000	Uh, there's nothing else knocking about to do water.
460000	462000	I've done a lot of mileage the last few days.
462000	465000	I think I'd rather do something a bit more camp-based today.
465000	466000	I've done water two days in a row, mate.
466000	467000	Yeah.
467000	469000	So this is my third day, so, you know.
469000	470000	Yeah, yeah, I appreciate it.
470000	473000	Well, we've got 11 people here.
473000	475000	But they're not here now, mate.
475000	476000	Yeah.
476000	478000	Uh, Carl, why don't we just sit here and tidy the camp, then?
478000	479000	I'll do it.
479000	480000	That's no problem, mate.
480000	482000	Cheers.
482000	483000	Cheers.
483000	484000	Thanks, Piers.
484000	485000	All right.
485000	486000	Off we go.
490000	493000	I just sat in the office in front of the screens.
493000	495000	I know there's more to life than that.
495000	499000	So I just got to a stage where I wanted to break away from it, step away from the screens,
499000	502000	and just do something different.
502000	505000	I like to think I can step up to most challenges.
505000	509000	I like to see myself as someone who will see things through to the end.
509000	515000	So if I was a person who was struggling in the group and was a useless one,
515000	517000	that would be a big knock to my confidence.
517000	518000	Big knock.
522000	524000	I was a little disappointed in Kyle.
524000	526000	It would have been nice if he just stepped up to the plate and said,
526000	528000	you know what, I'll step in.
528000	531000	But he wasn't in the mood to do that today.
531000	533000	It's not so much that I'm hungry.
533000	535000	The worst thing is just the energy.
535000	541000	I never for a second thought my energy would be as low as it has been.
541000	542000	Fuck.
542000	544000	I can't even lift up my legs.
551000	553000	Now keep an eye out for Mr. Fucking Yurt.
554000	556000	See a caiman, I'll scream.
556000	557000	Yes.
557000	559000	How big did they say they get?
559000	561000	Fuck, there's not many of these.
561000	564000	Six foot, the caiman, and six meters, the alligator.
564000	565000	Oh, these are alligators?
565000	566000	Yeah.
566000	567000	Fuck it.
570000	573000	I don't know where Vic gets his energy, but I need half of that energy.
573000	578000	Because Vic has got energy all the way through the day.
578000	580000	If I could take anything away from this island,
580000	582000	I would like to be a little bit more like Vic Fellows.
584000	586000	See, like that.
586000	588000	That is actual shit.
588000	590000	What the fuck is this, Jurassic Park?
590000	591000	That's not shit.
591000	592000	That's shit.
592000	593000	That's not shit, fella.
593000	594000	What is it?
594000	595000	That's mud out of here.
595000	596000	Do you know what it is?
596000	598000	I'm sure there's a T-Rex here.
598000	599000	Oh, fuck, that's great.
602000	605000	What do you do if you see something snapping at your feet?
605000	606000	What are you going to do?
606000	608000	Are you going to just machete it?
608000	611000	Worst case scenario, we can't pin him or what have you.
611000	612000	I'm fighting for my life.
612000	613000	It's happening, isn't it?
613000	616000	As best as a facilities manager can do.
621000	622000	I'm 47.
622000	625000	This could be my last crazy hurrah.
625000	628000	And what better way to do it than the ultimate challenge
628000	629000	of surviving?
629000	630000	I mean, it's the ultimate challenge.
630000	632000	Can I provide for me?
635000	636000	Yes, I am very excited.
636000	638000	It's Boy Scouts shit, isn't it?
638000	639000	We're all over it.
639000	641000	We get knives and spears and stuff,
641000	642000	maybe even a bow and arrow to make.
642000	643000	I mean...
643000	644000	How good does it get?
644000	646000	Excited is an understatement.
646000	648000	Yes, sometimes I have to keep...
649000	651000	..put a lid on it to not let it get like,
651000	652000	boom, shiz!
652000	654000	That kind of excitement, yeah.
656000	658000	Just keep quiet, keep quiet, guy,
658000	661000	cos if there is a croc, we'll see it.
661000	662000	Where do caimans live?
662000	663000	I don't know.
665000	667000	I presume they lived in the water.
668000	670000	I thought they lived up trees.
671000	672000	Do caimans live in holes?
673000	675000	I reckon caimans live in holes.
675000	676000	Oh, dear.
676000	677000	Well, I'm making that up, but...
677000	679000	It sounds good, though.
682000	683000	I think I've got something in my bollocks
683000	684000	that's coming out.
686000	688000	Crocodiles are ambush predators.
688000	690000	They hunt their prey in shallow waters
690000	692000	and are masters of the stealth attack.
694000	695000	We'll raise a sharp tee,
695000	699000	and a bite that's three times more powerful than a lion.
699000	700000	Shhh.
700000	703000	Sam, shhh.
703000	705000	That is a caiman.
705000	706000	Look, he's up, he's up.
706000	707000	Fuck, he's a biggie.
707000	709000	Now, there is our baby.
709000	710000	That is dinner, yeah.
710000	711000	That is our dinner.
711000	713000	We can get in there.
713000	715000	Would it be worth swimming in?
716000	717000	Not for me.
717000	718000	I'm not swimming in that.
718000	719000	Not a chance.
722000	724000	That is insanity, yeah.
725000	726000	Fucking bastard, him.
728000	729000	Look, look, look, he's moving.
729000	730000	He's moving.
730000	732000	Got a bit of a ripple behind him.
732000	736000	Look at that sign in that fucking head.
736000	739000	He's an inquisitive, he's a little boy, isn't he?
739000	742000	Come to daddy.
742000	744000	We now need to find where he comes in and goes out.
748000	751000	OK.
751000	753000	Wherever we are now is where they come out.
753000	754000	Yeah.
754000	755000	Dead right.
755000	759000	That is where crocs come out of the water.
759000	761000	Yeah, that is perfect, isn't it?
761000	765000	I'm going to make a snare there, right towards the water.
765000	768000	Have you ever caught anything that snared before?
768000	770000	Have I ever made a snare before?
770000	772000	No.
772000	773000	Oh, he's there, he's about.
773000	774000	He's back, he's back.
774000	775000	Where, where, where?
775000	776000	Straight through here.
776000	777000	Straight through here.
777000	778000	See him?
778000	780000	He fucking has got closer as well, hasn't he?
780000	783000	That shifty little bastard has got closer, hasn't he?
783000	784000	He's not scared of us.
788000	789000	He'll have to keep an eye on him.
789000	791000	Well, I'm setting the trap.
791000	793000	That's why I keep looking past you.
793000	795000	He keeps dropping and dunnies that bugger him.
795000	798000	The men have had just two days' survival training
798000	801000	where they learnt how to set basic traps.
801000	804000	But the reality of catching a crocodile
804000	808000	that can measure up to 13 feet is a different matter entirely.
808000	811000	This is proper Boy Scout shit, this, isn't it?
811000	812000	He's going to test it.
812000	813000	I'll test it.
813000	815000	Yeah?
815000	817000	Oh!
817000	818000	Dinner is served.
818000	819000	Oh!
819000	820000	Eh?
820000	821000	That's not bad, is it?
821000	822000	That's all right, fellas.
822000	823000	Oh!
823000	824000	That's the one.
824000	825000	Let's go.
825000	826000	Let's bust a move.
826000	827000	Back to base, yeah?
827000	830000	Back to base.
830000	833000	Late afternoon.
833000	836000	58-year-old Phil is returning from the water run
836000	838000	with the help from Dr Pearce.
838000	839000	Watch your step.
839000	840000	Yeah.
840000	842000	It's a good thing we didn't carry over the jerry can
842000	844000	up and down these rocks.
844000	845000	Whoo!
845000	847000	And home.
847000	851000	While Kyle continues to rest on the beach.
851000	853000	There's a feeling amongst Camden
853000	857000	he's not contributing as much as he should be.
857000	860000	It's just I feel like I've just been trying to deal with the fire
860000	862000	and do the water,
862000	867000	and Kyle's been kind of doing the feet manicuring bit.
867000	869000	It's a little bit like anything in life, you know.
869000	871000	You can have a rest, but do the work first.
871000	875000	It's been almost two weeks since Kyle ensured the group's survival
875000	877000	by starting a fire with his guys.
877000	879000	And now he's got his glasses.
879000	881000	Now, when Kyle first got in here, he cracked the fire.
881000	883000	It was absolutely brilliant.
883000	885000	Since then, man's not got a day's graft in him.
885000	887000	Not a freaking day's graft in him.
889000	892000	I get the distinct impression, Vic, that you're getting a bit miffed.
892000	895000	I'm just getting miffed by anybody that springs into my mind
895000	897000	that's not sweating as hard as me.
897000	899000	Pull your thumb out of your arse, you lazy bastard.
905000	906000	Todd?
906000	907000	Yeah?
907000	909000	I feel like I'm kind of nearing my physical limit,
909000	911000	and I think it's quite a common event I'll come down
911000	914000	and you're doing your feet or you're sitting by the fire.
914000	916000	I'm going to be completely honest with you.
916000	918000	I feel that perhaps you haven't been pulling your weight
918000	919000	in the last week or so, OK?
922000	926000	Today, for me, has been a bit of a challenging one, actually.
926000	927000	Can't lie.
927000	931000	I haven't been able to do as much as I thought I would be able to,
931000	934000	and, like, when you're in this situation,
934000	936000	if you can't contribute,
936000	938000	you feel like you're really letting the team down.
945000	947000	Despite the men's best efforts,
947000	950000	it's yet another day with empty stomachs.
951000	953000	Bloody hell.
953000	955000	Boys, there's no meat on you.
955000	957000	You need a bit of cake.
958000	961000	Hey, look, you can see Piers' heart beating through his rib, look.
961000	963000	Fucking hell.
966000	968000	Being hungry...
968000	970000	..really...
970000	974000	..does affect your mental and your physical state.
974000	977000	Every step is hard when you're hungry.
977000	980000	There would be a stage where, soon,
980000	983000	our bodies give up on us.
984000	986000	And we're not far from that.
986000	993000	How are you feeling now?
993000	995000	Exhausted.
997000	1000000	After over two weeks of near starvation,
1000000	1003000	the men's situation is becoming critical.
1007000	1010000	Desperate to catch a high-calorie prize,
1010000	1013000	Vic and Dan have decided to go on a diet.
1013000	1015000	It's been a long, long journey.
1015000	1018000	Vic and Dan have set multiple crocodile traps
1018000	1020000	around the island's freshwater lagoon.
1020000	1022000	Bingo.
1022000	1025000	But so far, they haven't caught a thing.
1025000	1027000	By the look of it, it's done sod all.
1027000	1029000	Fuck.
1029000	1030000	Shit.
1030000	1032000	Nothing, I'm afraid.
1034000	1037000	On such an extreme low-calorie diet,
1037000	1039000	you're susceptible to infection
1039000	1041000	and your mental capacity is low.
1041000	1043000	And if nothing changes,
1043000	1045000	really, you're on borrowed time.
1045000	1048000	Over two weeks with barely any food going in,
1048000	1051000	the men's morning routines are anything but regular.
1053000	1055000	I feel like it's got to that moment where
1055000	1058000	I'm probably going to need to go for a shit-sink.
1058000	1060000	When it comes to options,
1060000	1062000	if they've got land or sea,
1062000	1064000	I think I'm going to opt for the sea.
1067000	1068000	Where are you going to go?
1068000	1071000	I need to figure out, is it sort of wash in that direction?
1071000	1073000	I don't know.
1073000	1076000	I need to figure out, is it sort of wash in that direction or...?
1083000	1084000	He's going for it.
1084000	1086000	Carl's taking a dump in the sea.
1086000	1088000	Good man.
1088000	1091000	Yeah, the most beautiful spot in the world to take a dump in.
1093000	1095000	Have you joined the poo crew?
1095000	1097000	So, I'm one for, back at home,
1097000	1100000	maybe a four to five shit a day, man.
1100000	1102000	A day? A day?
1102000	1105000	I'm pretty good, I'm very regular.
1105000	1109000	And I haven't shat until half six this morning
1109000	1111000	and now I feel enlightened.
1113000	1115000	I'm now part of the poo crew.
1115000	1119000	But 28-year-old Piers, the group's doctor,
1119000	1121000	isn't having as much success.
1121000	1123000	How's your, um...
1123000	1125000	How are the bowels? Bowels?
1125000	1126000	Any movement yet?
1126000	1128000	Being stubborn.
1128000	1130000	Wow. No poo for 15 days.
1133000	1134000	It'll come.
1139000	1142000	Are you ready? One, two, three.
1142000	1143000	With no food to eat,
1143000	1147000	the men still have to expend their energy on vital tasks,
1147000	1149000	like keeping their fire going
1149000	1152000	to boil and purify the water that they collect.
1152000	1153000	Hello, hello.
1153000	1156000	If you want to get a nice picture of Carl grooming himself,
1156000	1159000	you're quite welcome to do that while we're all getting wood.
1159000	1161000	Where's that? Just round the corner, doing his toes after.
1161000	1162000	He's just had a swim.
1165000	1167000	Today, we were supposed to all contribute getting wood
1167000	1169000	and then do individual tasks,
1169000	1171000	and he has done nothing.
1171000	1175000	I think my tolerance has kind of reached a bit of a limit.
1175000	1177000	You know, if you do let it boil inside,
1177000	1179000	it does become a bit of a problem when it comes to a head,
1179000	1180000	like it is now.
1183000	1185000	I can't hold something. I can't.
1185000	1187000	But, listen, when everybody...
1187000	1188000	And it ain't just me.
1188000	1190000	When lots of people bitch and chaff
1190000	1192000	and nobody seems to want us to confront it,
1192000	1194000	I think, come on, boys, we're team-mates.
1199000	1200000	Fuck it.
1203000	1205000	Where is he?
1205000	1207000	Up there, sound his arse.
1209000	1212000	He's taking piss. Come on, man, fucking hell.
1212000	1213000	Kyle!
1217000	1218000	Kyle.
1218000	1219000	How you doing?
1220000	1222000	I'm busting my knackers, fella, doing wood,
1222000	1223000	and you're doing your feet.
1223000	1225000	I'm not doing my feet. I've come out of the water.
1225000	1226000	Whatever.
1226000	1227000	Yeah.
1227000	1228000	It's not just me.
1228000	1229000	It just seems that I'm the only one with balls
1229000	1230000	to come up and speak to you.
1230000	1231000	No, that's fine.
1231000	1232000	Every fucker's bitching and moaning
1232000	1233000	that you're never doing wood with us.
1233000	1235000	We're all sweating our bollocks off up there, fella,
1235000	1236000	and it looks like...
1236000	1237000	Yeah, yeah, sorry.
1237000	1239000	Looks like you're doing fuck all when it comes to wood.
1239000	1241000	Admittedly, I'm not getting wood now,
1241000	1242000	cos I've just come out of the water,
1242000	1243000	cos I went through shit.
1243000	1247000	We're fucking pulling tree upon tree upon tree,
1247000	1249000	and it does look like you're always doing your feet.
1249000	1251000	I won't lie to you, it does.
1251000	1252000	Let's go.
1257000	1260000	It was almost like a bit of a cheap shot from Vic.
1260000	1264000	He's clearly got stuff which has been bubbling under the surface.
1264000	1266000	I felt like...
1267000	1269000	..I haven't fitted in with the group,
1269000	1274000	and, you know, I've done stuff to try and change that.
1276000	1279000	But sometimes it's just the group dynamics
1279000	1280000	that's on for everyone.
1282000	1285000	People are starting to fray around the edges.
1287000	1288000	Some of them are fraying,
1288000	1291000	some of them are coming away at the seams.
1291000	1294000	We seriously, seriously need to find
1294000	1296000	a sustainable source of food.
1298000	1300000	As the men continue to physically decline,
1300000	1302000	the group is becoming fractured,
1302000	1304000	and if members of the group are perceived
1304000	1306000	not to be pulling their weight,
1306000	1308000	they can easily become alienated.
1308000	1310000	And then if those rifts aren't healed,
1310000	1313000	it becomes a downward spiral of conflict
1313000	1316000	that ultimately could destroy the men's community.
1321000	1322000	Hello.
1327000	1329000	There's a net here. A net?
1329000	1330000	Yeah.
1331000	1333000	Oh, yeah.
1333000	1334000	Mate, this could be big.
1334000	1336000	This could make a big difference to us.
1336000	1337000	Game-changer.
1337000	1338000	Game-changer.
1338000	1340000	Could be.
1340000	1341000	Fellas!
1341000	1343000	Look what I found!
1343000	1345000	We've got ourselves a gill net!
1345000	1346000	Whoo-hoo!
1346000	1348000	Fucking brilliant.
1348000	1349000	It's pretty fucking big!
1349000	1350000	Yeah!
1350000	1351000	Get in there, baby!
1351000	1352000	What a whale!
1352000	1353000	Nice one, Will!
1353000	1354000	Sting of the dog!
1354000	1355000	Yes!
1355000	1356000	Roar, roar!
1356000	1357000	Brilliant.
1357000	1358000	Let's get ourselves some tea.
1359000	1361000	If we get this net in the water,
1361000	1365000	then we have our best hope yet of catching fish.
1365000	1367000	For thousands of years,
1367000	1369000	fishermen have been perfecting the art
1369000	1371000	of setting their fishing nets.
1371000	1375000	If you get it right, you unlock the ocean's larder.
1375000	1376000	If you get it wrong,
1376000	1379000	then all they'll be doing is wasting their precious time
1379000	1380000	and precious energy,
1380000	1383000	two resources that they can't afford to waste.
1385000	1387000	Net's out. Exciting times.
1387000	1388000	What are we looking at?
1388000	1389000	Yeah.
1390000	1391000	Feel quite positive.
1391000	1393000	I think it will catch fish.
1393000	1395000	I think it might even catch fish for us tonight.
1395000	1396000	Yeah.
1402000	1405000	Exhausted after a morning's hard work,
1405000	1407000	the men allow themselves some downtime.
1407000	1409000	So, boys, here's one.
1409000	1412000	You can request Bear to bring you one item
1412000	1413000	for the journey back.
1413000	1415000	Thermos full of English breakfast tea.
1415000	1417000	I am going to get a bottle of octomar whisky.
1417000	1418000	A whole bottle of whisky?
1418000	1421000	A whole bottle of octomar whisky for my journey back.
1421000	1422000	Bam!
1422000	1424000	If I could...
1424000	1426000	..chicken pie my wife makes,
1426000	1428000	and she always puts your name in it as well.
1428000	1429000	Nice.
1429000	1431000	All the big love art and all that sort of thing.
1431000	1432000	Pock pastry lid?
1432000	1433000	Yes, dead right.
1433000	1434000	It's quite easy.
1434000	1436000	You see if it doesn't work out with you and your missus,
1436000	1437000	can you give her our number?
1437000	1440000	I honestly think there's something wrong with her upstairs
1440000	1442000	because she really is a nice woman.
1442000	1443000	How did you find such a nice woman?
1443000	1444000	I have no idea.
1444000	1445000	What have you done?
1445000	1447000	You must have a size of a dick and a donkey.
1447000	1448000	Not a clue.
1448000	1450000	Not a clue, but God bless her.
1450000	1452000	How did you meet your wife, if you don't mind me asking?
1452000	1453000	I went round and knocked on her door.
1453000	1454000	Did you?
1454000	1455000	I fucking did, yeah.
1455000	1456000	Dead right I did, yeah.
1456000	1457000	What did you say?
